id,type,text1,text2,text3,text4,notes
ELYS_wing_chrono,SHIP,"A specialized drone that moves at extraordinary speeds. The small craft's living structure has been optimized for rapid energy cycling, sacrificing durability for unmatched mobility.","Chrono Drones represent a successful miniaturization of Elysium's temporal manipulation technology. These semi-autonomous organisms are cultivated with accelerated metabolic systems that experience time differently than conventional matter, allowing them to react and maneuver with preternatural speed. Their limited lifespan is considered an acceptable tradeoff for their tactical advantages.",,,

ELYS_wing_comet,SHIP,"A strike fighter equipped with miniaturized versions of Elysium's signature energy weapons. The craft features a streamlined design with forward-swept structures reminiscent of a comet's tail, enhancing its maneuverability during attack runs.","Comet Fighters are grown rather than built, each cultivated from specialized cellular structures that develop into semi-autonomous combat organisms. Their neural systems maintain a telepathic connection to their carrier vessel, allowing for coordination that transcends conventional communication limitations. These fighters excel at precision strikes against key target systems.",,,

ELYS_wing_stasis,SHIP,"A support drone. The craft's will be creating momentary vulnerabilities for allied forces to exploit.","Stasis Drones contain a variant of living tissue that naturally generates counterharmonic energy fields. When directed against enemy vessels, these fields create microscopic temporal distortions that disrupt system operations and crew coordination. Though incapable of causing significant damage directly, these drones create openings that determine the outcome of engagements.",,,

ELYS_wing_trail,SHIP,"A heavy fighter featuring reinforced living armor and enhanced weapon systems. The craft's organic structure has been cultivated to prioritize combat effectiveness over lifespan, resulting in a powerful but maintenance-intensive attack platform.","Trail Fighters represent a more conventional approach to fighter design within Elysium's biological engineering paradigm. Their living structures incorporate denser materials and enhanced weapon integration, creating organisms optimized for direct combat rather than specialized roles. Elite Elysium carriers often deploy these fighters as the core of their strike groups, supported by more specialized craft.",,,

# Main Planets
planet_elysium_prime,CUSTOM,"The ancestral homeworld of the Elysium faction, featuring vibrant forests and crystalline spires rising through an emerald canopy. The planet's advanced biofabrication facilities produce the living hull material used in Elysium ship construction.",,,,

planet_emberforge,CUSTOM,"A volcanic world whose magma flows are harvested for rare minerals critical to Elysium's advanced weaponry. Massive heat-resistant factories orbit the molten surface, while armored mining facilities tap into the planet's fiery heart.",,,,

planet_tidesong,CUSTOM,"An oceanic world whose vast, bioluminescent seas support massive underwater forests. The native aquatic flora produces compounds essential for Elysium's living ship cultivation process. Floating cities connected by crystalline bridges span the planet's tropical archipelagos.",,,,

# Other Celestial Bodies
planet_sylvanshroud,CUSTOM,"A verdant gas giant with emerald and azure cloud formations that swirl in mesmerizing patterns. The planet's upper atmosphere harbors unique energy-absorbing microorganisms studied by Elysium's bioengineers.",,,,

planet_mistwalker,CUSTOM,"A small barren moon orbiting Sylvanshroud, covered in fine crystalline dust that floats eerily in the low gravity. Ancient ruins hint at previous exploration or settlement.",,,,

planet_frostrim,CUSTOM,"A frozen world at the system's edge, encased in translucent ice that glows with faint blue luminescence. Deep beneath the ice lie dormant biological specimens preserved by Elysium for future research.",,,,

# Darkweave System

# Main Planets
planet_greenhold,CUSTOM,"An unexpected paradise orbiting a black hole, thriving within a carefully maintained bubble of artificial sunlight. The planet serves as Elysium's secondary capital and primary agricultural center, its bioadaptive plants creating a lush haven in the void.",,,,

planet_thaumaspire,CUSTOM,"A volcanic forge world where Elysium harnesses unique gravitational energies from the nearby black hole to create exotic alloys for their most advanced ships. The surface is covered with specialized factories and research facilities built into volcanic caldera.",,,,

planet_shadowveil,CUSTOM,"A massive gas giant with swirling violet and indigo clouds that trap and process radiation from the black hole into energy-rich compounds harvested by automated facilities.",,,,

planet_whisperhold,CUSTOM,"A small, heavily bombarded world that orbits perilously close to the black hole. Its surface is scarred with impact craters that glow with eerie blue light, believed to be caused by temporal anomalies.",,,,

planet_luminarch,CUSTOM,"An ice giant at the system's outer reaches, its frozen atmosphere reflects the void's darkness and the distant starlight in shifting patterns of crystalline beauty.",,,,

planet_ebontide,CUSTOM,"A barren moon of Luminarch bearing the scattered ruins of an unknown civilization. Elysium research teams have established outposts to study the ancient technology left behind.",,,,

# Voids Eye (Black Hole)
star_voids_eye,CUSTOM,"The supermassive black hole at the center of the Darkweave system, named for the ring of accretion material that gives it the appearance of a vast, watching eye. Elysium has harnessed its unique properties to power experimental temporal technology.",,,,